{
  "schemaVersion": "1.0",
  "evidenceType": "DER-Workload-Pilot",
  "policyVersion": "1.0.0",
  "packageVersion": "1.0.0-dev",
  "buildNumber": 24,
  "runId": "20260820-080000-ABC123",
  "tenantId": "11111111-1111-4111-8111-111111111111",
  "tenantName": "DER Disposable Test Tenant",
  "completedAt": "2026-08-20T12:01:00Z",
  "passed": true,
  "failures": [],
  "cleanupComplete": true,
  "prerequisites": {
    "packageManifestSHA256": "aaaaaaaaaaaaaaaaaaaaaaaaaaaaaaaaaaaaaaaaaaaaaaaaaaaaaaaaaaaaaaaa",
    "noWrite": {
      "path": "C:\\Evidence\\DER-NoWriteEvidence.json",
      "sha256": "bbbbbbbbbbbbbbbbbbbbbbbbbbbbbbbbbbbbbbbbbbbbbbbbbbbbbbbbbbbbbbbb",
      "runId": "20260820-070000-ABC123",
      "passed": true
    },
    "canary": {
      "path": "C:\\Evidence\\DER-CanaryEvidence.json",
      "sha256": "cccccccccccccccccccccccccccccccccccccccccccccccccccccccccccccccc",
      "runId": "20260820-073000-ABC123",
      "passed": true,
      "cleanupComplete": true
    }
  },
  "operatorApproval": {
    "Confirmed": true,
    "TokenRequired": "PILOT-WRITE",
    "TenantId": "11111111-1111-4111-8111-111111111111",
    "TenantName": "DER Disposable Test Tenant",
    "Account": "engineer@example.invalid",
    "DisplayName": "DER Pilot - DELETE ME - 20260820080000ABC123",
    "ConfirmedAt": "2026-08-20T12:00:10Z"
  },
  "workload": {
    "module": "Groups",
    "entryPoint": "Invoke-DERGroupsModule",
    "derId": "DER-PILOT-GRP-001",
    "displayName": "DER Pilot - DELETE ME - 20260820080000ABC123",
    "objectId": "22222222-2222-4222-8222-222222222222",
    "workloadStatus": "Completed",
    "rollbackStatus": "RolledBack"
  },
  "stateLifecycle": {
    "created": true,
    "removedAfterRollback": true
  },
  "controlledObject": {
    "derId": "DER-PILOT-GRP-001",
    "objectId": "22222222-2222-4222-8222-222222222222",
    "displayName": "DER Pilot - DELETE ME - 20260820080000ABC123",
    "objectType": "microsoft.graph.group",
    "ownershipClass": "DER-Owned",
    "activeObjectRemaining": false,
    "deletedObjectRemaining": false
  },
  "graphDelta": {
    "requestAttempts": 12,
    "transportRequests": 12,
    "transportReads": 9,
    "transportWrites": 3,
    "blockedWrites": 0,
    "post": 1,
    "patch": 0,
    "put": 0,
    "delete": 2
  },
  "authenticationDelta": {
    "writeSessionAttempts": 1,
    "writeSessionsOpened": 1
  },
  "steps": [
    {
      "Id": "PIL-001",
      "Status": "Pass",
      "Message": "Prerequisites passed.",
      "Data": null,
      "Timestamp": "2026-08-20T12:00:11Z"
    }
  ]
}
